{
  "title": "Conducteur de la séance",
  "subtitle": "Séance multi-parcours : 90 minutes",
  "schedule": [
    {
      "time": "00-05",
      "title": "Accueil",
      "items": [
        "Rappeler que chaque élève suit son parcours CodeCraft.",
        "Si une consigne n’est pas entendue ou si la connexion coupe, continuer la mission affichée.",
        "Fondations = 2 petits.",
        "Débutants = débutants autonomes.",
        "Avancés = anciens.",
        "Absents de la séance précédente = Rattrapage."
      ]
    },
    {
      "time": "05-10",
      "title": "Démarrage autonome",
      "items": [
        "Fondations : commencer étape 1.",
        "Débutants : mission de révision.",
        "Avancés : retrouver le projet et faire la checklist.",
        "Rattrapage : commencer le diagnostic.",
        "Professeur : observer et classer les élèves en rattrapage."
      ]
    },
    {
      "time": "10-32",
      "title": "Avancés",
      "items": [
        "Vérifier réellement le projet précédent : classes, cartes, border, padding, margin, border-radius et hover.",
        "Si le projet est perdu, utiliser immédiatement le projet de secours.",
        "Enseigner la notion de parent et d’enfants.",
        "Introduire display: flex, puis gap et justify-content.",
        "Faire tester flex-start, flex-end, center, space-between, space-around et space-evenly.",
        "Terminer en les envoyant sur Mission Flexbox, puis Défi autonome."
      ]
    },
    {
      "time": "32-40",
      "title": "Fondations",
      "items": [
        "Vérifier h1 et p.",
        "Vérifier la modification du texte sans casser les balises.",
        "Faire recréer h1 et p presque seul.",
        "Ne passer à ul/li que si h1 et p sont suffisamment maîtrisés.",
        "Ne pas perdre de temps en dépannage Meet."
      ]
    },
    {
      "time": "40-57",
      "title": "Débutants",
      "items": [
        "Vérifier la page reconstruite : titres h1 à h6, paragraphes, liste et lien.",
        "Enseigner img.",
        "Expliquer src et alt.",
        "Lancer ensuite l’exercice autonome avec plusieurs images."
      ]
    },
    {
      "time": "57-73",
      "title": "Avancés",
      "items": [
        "Vérifier la compréhension réelle de display: flex, gap et justify-content.",
        "Demander de montrer au moins trois valeurs de justify-content.",
        "Passer à 6 cartes.",
        "Réduire la largeur de la fenêtre.",
        "Seulement s’ils sont à l’aise avec le reste, introduire flex-wrap: wrap.",
        "Ne pas aller plus loin aujourd’hui."
      ],
      "say": [
        "Maintenant, si les cartes n’ont plus assez de place, elles peuvent passer à la ligne suivante."
      ]
    },
    {
      "time": "73-82",
      "title": "Petit tour Fondations + Débutants",
      "groups": [
        {
          "title": "Fondations",
          "items": [
            "Test sans modèle : créer un h1, puis un p.",
            "Vérifier que les deux balises sont produites sans regarder.",
            "Noter : acquis, à consolider ou pas encore acquis."
          ],
          "say": [
            "Fais-moi un titre tout seul.",
            "Maintenant un paragraphe."
          ]
        },
        {
          "title": "Débutants",
          "items": [
            "Vérifier img, src, alt et la deuxième image.",
            "Valider s’ils savent expliquer grossièrement les attributs et produire une image.",
            "Noter : acquis, à consolider ou pas encore acquis."
          ],
          "say": [
            "À quoi sert src ?",
            "À quoi sert alt ?"
          ]
        }
      ]
    },
    {
      "time": "82-88",
      "title": "Bilan rapide",
      "items": [
        "Demander éventuellement un partage d’écran très court à un débutant et à un avancé.",
        "Une seule réussite montrée par élève.",
        "Pas de présentation de cinq minutes."
      ],
      "say": [
        "Montre simplement une chose nouvelle que tu as réussie aujourd’hui."
      ]
    },
    {
      "time": "88-90",
      "title": "Conclusion",
      "items": [
        "Rappeler le fonctionnement par parcours et l’objectif d’autonomie."
      ],
      "say": [
        "Aujourd’hui chacun a avancé sur son propre parcours. C’est comme ça qu’on va fonctionner : quand je travaille avec un groupe, les autres continuent leurs missions.",
        "Le but est que vous deveniez progressivement capables d’avancer sans attendre constamment une consigne orale."
      ]
    }
  ],
  "principlesTitle": "Repères permanents",
  "principles": [
    "Une nouveauté à un seul groupe à la fois.",
    "Les autres groupes consolident en autonomie.",
    "Aucune consigne importante uniquement à l'oral.",
    "Aucun partage d'écran du professeur nécessaire.",
    "Si la connexion est instable, les élèves continuent la mission affichée."
  ],
  "connection": {
    "title": "Si ma connexion coupe",
    "items": [
      "Aucune consigne essentielle uniquement à l’oral.",
      "Les élèves continuent la mission affichée.",
      "Au retour, demander seulement où ils sont arrivés.",
      "Si l’audio est mauvais, utiliser le chat Meet avec une courte consigne par groupe."
    ],
    "returnPrompt": "Où êtes-vous arrivés sur CodeCraft ?",
    "chatExamples": [
      "Avancés : continuez Mission Flexbox.",
      "Débutants : restez sur l’exercice image.",
      "Fondations : continuez Étape 1."
    ]
  },
  "notes": {
    "title": "Notes professeur",
    "description": "Après le cours, attribuer un seul état par notion observée.",
    "states": [
      "Acquis",
      "À consolider",
      "Pas encore acquis"
    ]
  },
  "studentLinkLabel": "Ouvrir l'espace élèves"
}
